{
  "opera_riferimento": {
    "titolo": "Rental Family",
    "autore": "Hikari"
  },
  "titolo_definitivo": "La presenza affittata",
  "sottotitolo": "Su Rental Family di Hikari: come un legame nato per contratto può eccedere il contratto, e che cosa quest'eccedenza dice di un'epoca in cui il legame è diventato un servizio.",
  "scaletta": [
    {
      "numero": 1,
      "titolo_provvisorio": "Apertura: il funerale",
      "funzione": "Far entrare il lettore nel film attraverso una scena, non attraverso un concetto. Stabilire il tono dell'articolo: misurato, attento all'opera, non tecnico. Consegnare in poche righe l'oggetto del testo (un attore americano a Tokyo ingaggiato per fingere il dolore davanti al morto di uno sconosciuto) e da quel dettaglio scivolare alla domanda che sorregge l'articolo. Garantire che chi non ha visto il film abbia subito un appiglio concreto.",
      "materiali_di_riferimento": [
        "step_5a: scena 1 selezionata 'Il funerale come dolente affittato'",
        "step_4: paragrafo di apertura del saggio",
        "step_1: sintesi contenutistica (Phillip Vanderploeg, attore americano residente a Tokyo, ingaggio nell'agenzia di rental family)",
        "step_3: evidenza 'Funerale come dolente affittato'"
      ],
      "tesi_locale": "Il fatto che la prima scena di lavoro mostrata di Phillip sia una presenza affittata davanti al lutto di estranei non è un dettaglio: è la dichiarazione di poetica del film, che colloca il dispositivo della finzione relazionale nel territorio in cui non può essere ridotto a curiosità di mercato — sul bordo della morte, dove la presenza è già sempre questione seria.",
      "contenuti_chiave": [
        "L'immagine concreta: dosare il pianto, restare al posto giusto, fingere di aver conosciuto un morto sconosciuto",
        "La cornice minima: Phillip è attore in difficoltà a Tokyo, è stato ingaggiato dall'agenzia Rental Family",
        "L'osservazione interpretativa breve: cominciare da qui significa che ogni successivo incarico dovrà giustificarsi davanti a questo orizzonte",
        "Lo scivolamento alla domanda dell'articolo: che cosa accade a un soggetto quando i suoi rapporti nascono per contratto e sotto falsa identità ma vengono attraversati con presenza piena?"
      ],
      "lunghezza_indicativa": "150-200 parole",
      "transizione_verso_sezione_successiva": "La domanda formulata in chiusura apre la sezione 2: dopo aver consegnato il film attraverso una scena, il testo passa a dichiarare cosa l'articolo sostiene del film. La transizione è naturale (dalla domanda alla risposta che il testo proporrà) e permette di entrare nella tesi senza spezzare il tono evocativo dell'apertura."
    },
    {
      "numero": 2,
      "titolo_provvisorio": "Cosa fa il film",
      "funzione": "Enunciare la tesi dell'articolo in forma accessibile. Dire al lettore con chiarezza che cosa il testo sostiene sull'opera, prima di argomentarlo nelle sezioni successive. Inserire in modo asciutto e distribuito le coordinate minime della trama (struttura episodica con incarichi brevi e due archi maggiori, Mia e Kikuo). Posizionare l'opera nel suo orizzonte storico-culturale (fenomeno reale dei rental family service, contesto della solitudine giapponese, regia di Hikari, coproduzione USA-Giappone, Brendan Fraser).",
      "materiali_di_riferimento": [
        "step_5a: tesi editoriale (formulazione_accessibile)",
        "step_4: tesi interpretativa centrale",
        "step_1: struttura formale, contesto storico-culturale, fenomeno rental family service",
        "step_2: nucleo tematico centrale e ipotesi critica provvisoria"
      ],
      "tesi_locale": "Rental Family è un film su come un legame nato per contratto e sotto falsa identità possa generare, attraverso il tempo e la presenza piena, qualcosa che la cornice contrattuale non sa più contenere — e su che cosa accade a un'istituzione che vende presenze quando qualcuno prende sul serio fino in fondo il proprio mandato. Non è meditazione astratta sulla finzione: è diagnosi situata di un'epoca in cui il legame è diventato un servizio.",
      "contenuti_chiave": [
        "Sinossi essenziale distribuita: Phillip attore americano a Tokyo, ingaggiato dall'agenzia, struttura episodica, due archi maggiori (Mia bambina, Kikuo anziano)",
        "Il fenomeno reale dei rental family service giapponesi (attivi dai primi anni '90): non invenzione narrativa",
        "La cornice della regia (Hikari, cineasta nippo-americana) e della coproduzione USA-Giappone con dialoghi nelle due lingue, come atto di mediazione transculturale",
        "Coordinate di collocazione: uscita 2025, prima al Toronto International Film Festival, distribuzione Searchlight, interpretazione di Brendan Fraser dopo The Whale",
        "Sfondo della solitudine come questione sociale codificata in Giappone (politiche pubbliche, denatalità) — necessario perché l'agenzia non appaia stranezza folclorica",
        "Formulazione della tesi: il film non assolve la finzione e non la condanna, ne mostra il punto in cui un'istituzione che vende presenze viene messa in difficoltà dagli effetti reali che produce"
      ],
      "lunghezza_indicativa": "200-280 parole",
      "transizione_verso_sezione_successiva": "Avendo enunciato la tesi e dato le coordinate minime, il testo deve ora argomentare. La transizione introduce la prima coppia di concetti che la sezione successiva sviluppa: la differenza fra incarichi brevi e archi lunghi, fra prestazione e legame. Frase-ponte: 'Per capire come questo accade nel film, conviene partire da una distinzione che la sua stessa struttura mette in scena.'"
    },
    {
      "numero": 3,
      "titolo_provvisorio": "Prestazione e legame",
      "funzione": "Sezione di sviluppo centrale. Mostrare attraverso il racconto del film la differenza strutturale fra incarichi brevi (in cui la prestazione resta esecuzione di servizio: l'incarico arriva, si esegue, si paga, nessun cambio di campo) e archi lunghi (in cui la presenza dell'altro si sedimenta come riferimento interno e vincola il soggetto anche contro il mandato). Far emergere — narrativamente, non per via concettuale — la tesi che la finzione relazionale, esercitata con tempo e presenza, produce un'eccedenza che la cornice contrattuale non sa contenere. Inserire in posizione strategica la coincidenza fra mestiere (attore) e mansione (interprete di ruoli) come metafora trasparente del soggetto che si costituisce nel ruolo. Citare con cautela la formula riportata dallo spettatore-utente come testimonianza, non come citazione filologica.",
      "materiali_di_riferimento": [
        "step_5a: assi/nodi selezionati (asse 2, interiorizzazione dell'altro, moralità adattiva)",
        "step_5a: formule linguistiche suggerite per asse 2",
        "step_4: distinzione fra incarichi brevi e archi lunghi nel testo del saggio",
        "step_3: configurazione strutturale dominante e dinamica dell'opera",
        "step_2: tensione fra contratto ed eccedenza affettiva, tensione fra maschera e volto",
        "step_1: temi espliciti (Confine fra finzione e realtà, Identità dell'outsider)",
        "step_4: scena 'La rinuncia all'occasione di lavoro per restare con Mia'"
      ],
      "tesi_locale": "Negli incarichi brevi (il funerale, il finto fidanzato di Yoshie Ikeda, le situazioni minori) il dispositivo opera come motivazione sostitutiva: comportamento corretto sostenuto da rinforzo esterno, senza presenza interna del lavoratore. Negli archi lunghi qualcosa si rompe: il tempo passa, gli incontri si accumulano, e la presenza dell'altro cessa di essere oggetto di servizio per diventare riferimento interno che vincola il soggetto anche quando — anzi, soprattutto quando — la cornice contrattuale richiederebbe il contrario. La coincidenza fra il mestiere di Phillip (attore) e la sua mansione (interprete di ruoli relazionali) non è ironia, ma metafora trasparente: il soggetto si costituisce nel ruolo, e la prestazione, lungi dall'essere il contrario dell'autenticità, è il piano sul quale l'autenticità si gioca.",
      "contenuti_chiave": [
        "L'architettura formale del film come argomento: la struttura episodica con incarichi brevi non è ornamentale, è dimostrazione del passaggio",
        "Esempi concreti di incarichi brevi: il funerale già visto in apertura, il finto fidanzato per il matrimonio di copertura di Yoshie",
        "Il momento di svolta: la rinuncia di Phillip a un'occasione di lavoro maggiore per non venire meno alla relazione con Mia (segno strutturale dell'avvenuta interiorizzazione, non scelta razionale ma riorganizzazione del campo)",
        "La coincidenza mestiere/mansione come metafora trasparente: Phillip è attore di mestiere e attore di vita",
        "La citazione riportata dallo spettatore ('a Roma fai come i romani… significa anche essere un po' di più di quello che sei') come testimonianza, presentata con cautela",
        "Formula chiave da usare: 'qualcosa, nell'esercizio del ruolo, si è sedimentato come presenza interna che vincola dall'interno'",
        "Evitare etichette tecniche ('asse affettivo-morale', 'interiorizzazione dell'altro' come categoria, 'moralità adattiva')"
      ],
      "lunghezza_indicativa": "350-450 parole",
      "transizione_verso_sezione_successiva": "Avendo posto la differenza fra prestazione e legame e mostrato il punto di svolta nell'arco di Mia, il testo deve ora portare il lettore al pilastro narrativo centrale: il momento in cui l'eccedenza affettiva paga apertamente il prezzo della propria differenza dalla cornice contrattuale. Frase-ponte: 'Il punto in cui questa eccedenza diventa visibile come accaduto, e non più solo come traccia, è il viaggio ad Amakusa.'"
    },
    {
      "numero": 4,
      "titolo_provvisorio": "Il viaggio ad Amakusa",